{
  "id": "example.mod",
  "name": "Example Mod",
  "version": "0.1.0",
  "description": "Starter mod package for utool.",
  "author": "utool",
  "target": {
    "gameId": "your-game",
    "engineVersion": "4.27",
    "minGameVersion": "1.0.0"
  },
  "dependencies": [],
  "contentRoots": ["content"],
  "patchFiles": ["patches/gameplay.json"],
  "codeProject": "code/ExampleMod.csproj",
  "pak": {
    "output": "dist/ExampleMod_P.pak",
    "mountPoint": "../../../your-game/"
  }
}
